ConversationID,occurredDate,conversationType,notesLength,emoticon,notes
4ffadf9be4b056530e606ad0,7/9/12 13:41,Client,861,,"Hello ,Welcome to Retrofit! I look forward to working with you over the coming months as your Program Advisor. I also have your Welcome Kit all set to be shipped. You should have received an email with a link to your Retrofit dashboard when you signed up, so when you have the time, please log in and get the items on your New Client Checklist started. Also by clicking """"View at Retrofit"""" to this email notification you will be directed straight to your Checklist as well.You and I need to get an Introduction call on the books. This call should last for about 30 minutes, and will be our chance to get to know one another, review the details of the program, set up some expectations, and have a look at the timeline. Please send me some times that you have available for this week or next week.I look forward to working with you,"
4ffdcb1ee4b056530e607bde,7/11/12 18:51,Client,136,,"Hi It was great talking with you today. Here is the link to download the Retrofit cookbook.http://www.retrofitme.com/recipes"
4ffe181fe4b056530e607d6f,7/12/12 0:19,Client,49,,Got my devices tonight.  Will be setting them up.
4ffecfede4b056530e607fe1,7/12/12 13:23,Client,74,,Weighed myself with new scale this morning.  My scale was off by 8 lbs :-(
4ffecfede4b056530e607fe1,7/12/12 13:23,Client,63,,", Is it on a hard surface? How do you know it was off?"
4ffed60be4b056530e60806d,7/12/12 13:50,Client,190,,"Sorry, I meant my personal scale was off by 8 lbs.  I've been weighing 180 on it pretty consistently. On the Withings I'm 188, which I assume is more accurate than my cheap Walmart scale :-)"
5000308de4b056530e50b97d,7/13/12 14:28,FoodLog,33,,Whoops!  Make that Thursday 11 pm
5000cd82e4b056530e6087f9,7/14/12 1:38,Client,95,,Just got back from the grocery store.  Going to try some food from the recipe book this weekend
500195e9e4b056530e60886b,7/14/12 15:53,Client,288,,"changed my fitbit to be more sensitive yesterday because I felt like it was not accurately registering how long it takes me to fall asleep.  I think that part is more accurate, but it also puts me awake for long periods of time in the middle of the night, which I don't think is accurate."
5002e494e4b056530e50bf7c,7/15/12 15:41,FoodLog,25,,and four pineapple chunks
5003368be4b056530e608c2f,7/15/12 21:30,Client,44,,changed my fitbit sensitivity back to normal
5003724de4b056530e608cfa,7/16/12 1:45,Client,56,,Forgot to wear my fitbit for about two hours tonight :-(
50043961e4b056530e608ed4,7/16/12 15:55,Client,911,,"Hello ,By way of this note, I would like to introduce you to your Wellness Expert team for the duration of your time in the Retrofit program. Please work together to get your initial Wellness Expert sessions scheduled with each expert as follows:Week of 7/16/2012 (current week)Registered Dietitian ()Week of 7/23/2012Behavior Coach ()Week of 7/30/2012Exercise Physiologist (): You can access each of their bio's and applicable contact information (Skype handle/email/phone) from your Retrofit dashboard.Team:  prefers her Skype sessions take place during-- Afternoons and evenings-- WeekendsPlease be sure to note your appointment times on the client dashboard once confirmed. Lastly, please request  as a contact on Skype so you can easily connect at your first session."
50044d7ae4b056530e608f7b,7/16/12 17:20,Client,179,,"Hi ,I am excited to get to work with you!  I can do any evening this week Wed-Friday....let me know what would work best for you.  I will email you as well.  Take care."
50045b4fe4b056530e608fc5,7/16/12 18:19,Client,88,,Yay!  I found a new Pilates studio in town that has lots of classes that I could attend.
50045b4fe4b056530e608fc5,7/16/12 18:19,Client,469,,"Well on that awesome note... Welcome to the Retrofit family! I am so excited to be on this journey with you! I will be your Exercise Physiologist for the duration of your program :)What does the week of the 30th look like for you? I am pretty much wide open in terms of evenings or first thing on weekend mornings. I am unavailable on Wednesdays. Please throw out some dates/times and Lets get us on the books!I so look forward to """"meeting"""" you! Happy Monday!"
50045b4fe4b056530e608fc5,7/16/12 18:19,Client,118,,"Here you go in order of preference: Monday the 30th at 6:30 pm; Mon, Tue, or Thur at 12:30 pm; Tue or Thur at 6:30 pm."
50045b4fe4b056530e608fc5,7/16/12 18:19,Client,45,,Monday at 6:30 is perfect! Setting us up now!
50045b4fe4b056530e608fc5,7/16/12 18:19,Client,33,,Great!  Looking forward to it :-)
5004c512e4b056530e609226,7/17/12 1:51,Client,163,,"Hi , I'm  and i'm excited to be your behavior coach!  I would be available to meet at any time on Sunday between 9AM and 9 PM other than 11 AM and 7PM"
5004c512e4b056530e609226,7/17/12 1:51,Client,57,,Hi .  Would that be Sunday the 29th?  How about 6 pm?
5004c512e4b056530e609226,7/17/12 1:51,Client,65,,"No, it would be Sunday the 22nd.  Does 6:00 PM work for you then?"
5004c512e4b056530e609226,7/17/12 1:51,Client,39,,"Yes, that's fine with me. See you then."
5004de69e4b056530e50c968,7/17/12 3:39,FoodLog,6,,at 8pm
5005726ae4b056530e6093b9,7/17/12 14:10,Client,22,,BMI under 30 today!!!!
5005726ae4b056530e6093b9,7/17/12 14:10,Client,4,,Yes!
500572b6e4b056530e6093be,7/17/12 14:12,Client,42,,Forgot to wear my Fitbit to work today :-(
5005b04be4b056530e6095b9,7/17/12 18:34,Client,128,,Picked up fitbit at lunch.  Sleep data from last night seems to be most accurate yet.  Will keep it on normal sensitivity level.
5005cc77e4b056530e6096bd,7/17/12 20:35,Client,47,,Have a Pilates class scheduled for Thursday :-)
5005cc77e4b056530e6096bd,7/17/12 20:35,Client,96,,Look at you go! Fantastic! I can't wait to hear what you think of it! I personally LOVE pilates.
50061061e4b056530e50cd78,7/18/12 1:24,FoodLog,45,,Love all of your food logging!!!!  Way to go!
500707c0e4b056530e50d1e3,7/18/12 19:00,FoodLog,25,,and 2 multigrain crackers
500c92e1e4b056530e60acbf,7/22/12 23:55,Client,1011,,"Hey , it was so great to meet you today.  Below are the articles, book title and  tasks we discussed. I‰Ûªm excited to work together and look forward to seeing your posts. TasksContinue stress breaks into day Continue logging food consistently Start reaching out using the dashboard to track successes Eat one meal mindfully per weekBookFull Catastrophe Living: Using the Wisdom of Your Body and Mind to Face Stress, Pain, and Illness by Jon Kabat-ZinnEating Mindfully Checklisthttp://eatingmindfully.com/wp-content/uploads/2012/01/Awarenesschecklist.pdfEating Mindfully Graphicshttp://eatingmindfully.com/wp-content/uploads/2012/01/mindfuleatingplate1.pdfSelf Rating Hunger Scalehttp://medweb.mit.edu/pdf/hunger_scale.pdfTips for avoiding mindless eating/general tips to eat lesshttp://mindlesseating.org/pdf/Mindless_Dieting_01.pdfMindful Dieting Websitehttp://www.beckdietsolution.com/Listening to Hungerhttp://amihungry.com/pdf/consumed-newsletter-vol-ii-issue-3.pdf"
500cae98e4b056530e60acf7,7/23/12 1:53,Client,37,,Just ordered the Kabat-Zinn book. :-)
500d776be4b056530e60afb6,7/23/12 16:10,Client,364,,"Went to doctor this morning for a flare up of Morton's neuroma on my left foot.  It causes burning pain on the top and bottom foot at the base of the toes.  Received an injection and am supposed to stay off my feet for a few days.  I have a wheelchair stored in the garage.  I'm going to take it out and use that at home to get my """"steps"""" in for the next few days."
500d776be4b056530e60afb6,7/23/12 16:10,Client,264,,"That sounds terrible. I am so sorry! Have you been getting these flare ups on and off over the years? How often? Can you recall any time when it """"triggers"""" it per se?On the positive side.. You will be getting a good upper body workout wheeling yourslef around :)"
500d776be4b056530e60afb6,7/23/12 16:10,Client,577,,"Yes, I have had this for several years.  I think it is related to when I broke that foot five years ago.  It has been under fairly good control that past year because I learned some exercises at PT that I now do at home.  I think it flared up after I went rowing a couple of weeks ago due to the strap that holds your foot in.  I have been rowing since and focused on not pulling my feet against the straps and did fine.  Do you have any suggestions for a good video for wheelchair exercises/aerobics?  I need to figure out some back up exercises I can do in these instances."
500d776be4b056530e60afb6,7/23/12 16:10,Client,30,,So sorry to hear. feel better!
500d776be4b056530e60afb6,7/23/12 16:10,Client,52,,I will send a few links you way some time this week!
500dabb4e4b056530e60b170,7/23/12 19:53,Client,77,,"So sorry to hear about your foot. What a bummer!Did you get your wheelchair?"
500dabb4e4b056530e60b170,7/23/12 19:53,Client,222,,"Yes, I have one from when I broke it.  I just have to limit being on my foot for a couple of days so I'll use it at home in the evenings so that I can stay mobile/active rather than sitting at the computer or TV all night."
500e05d2e4b056530e60b431,7/24/12 2:17,Client,175,,So much for staying off my feet.  I ended up having to go back to work tonight.  I can 't say I ate dinner mindfully tonight but I did take the time to prepare the right food.
500ec543e4b056530e60b645,7/24/12 15:54,Client,38,,Yay!  Weight is down in the 185 range.
500ec543e4b056530e60b645,7/24/12 15:54,Client,22,,Look at you! Congrats!
500ec543e4b056530e60b645,7/24/12 15:54,Client,10,,Nice work!
500eec56e4b056530e60b7a2,7/24/12 18:41,Client,436,,My foot feels a lot better today in spite of the fact that I did not minimize my weight bearing per doctors suggestion.  This has historically been part of my problem.  I will push myself regarding my various orthopedic problems and than end up having to sit out longer - vicious cycle. I really have to work sometimes to tell myself that I need to stop doing something or not do something that particular day because I am feeling pain.
500f6f26e4b056530e60baaa,7/25/12 3:59,Client,149,,Wednesday will be a challenge.  I will be working late and out of town with a group of coworkers.  Will have to carefully plan and take food with me.
501043eae4b056530e60bd0e,7/25/12 19:07,Client,299,,"Woo Hoo!  Done over three pounds now.Yesterday evening, I attempted to mindfully eat dinner. TV off, reading material put away.  I started off great but then started to go over in my head what needed to be done at work today.  Didn't realize it until the meal was almost oever. Need more practice!"
5010b579e4b056530e5c0524,7/26/12 3:11,ExerciseLog,52,,"This is great! How did your foot feel during class?"
5010b579e4b056530e5c0524,7/26/12 3:11,ExerciseLog,117,,"I was kind of worried about it, thinking I might have to sit out some things, but I didn't have any problems with it."
5010b579e4b056530e5c0524,7/26/12 3:11,ExerciseLog,8,,Oh good!
5012e15fe4b056530e60c823,7/27/12 18:43,Client,731,,"Hey ...Looking good! I wanted to let you know that Sunday, July 29th, we will be doing system maintenance and you may not be able to log food or exercise during the system update. We apologize for the inconvenience. The update is planned from 7am-11am and we will do our best to keep any service interruption to a minimum. Also, if you haven't already, please complete our quarterly client survey so we can be sure we're doing everything we can to make Retrofit the best healthy living weight loss program out there. It will take only a few minutes and give us valuable insight. It's totally confidential if you want it to be! You can find the survey here: https://www.surveymonkey.com/s/RetrofitClientSurveyJuly12"
5014122fe4b056530e60cfd6,7/28/12 16:24,Client,71,,"As I lose weight, my fat % is increasing.  I'm wondering why that is???"
5014122fe4b056530e60cfd6,7/28/12 16:24,Client,132,,It's fluctuating a little.... This can be normal depending on your hydration level at the time of weigh in. We'll keep an eye on it.
501720d4e4b056530e60da10,7/31/12 0:03,Client,61,,Nice work on losing weight for each of the first three weeks!
50172e41e4b056530e60daa1,7/31/12 1:00,Client,983,,"It was so great to meet you tonight ! You are heading on the right track, that's for sure. A few key points I want you take away from our session are:Goals:- CONSISTENCY IS KEY; I want you to continue your routine for the next 3 weeks and not skip a beat.- Make the conscious effort to increase her steps during the week; I want the intention at this point in time.. Progress, not perfection! - Log everything‰Û¢ Never skip more than 2 days of exercise in a row‰Û¢Something is ALWAYS better than nothing‰Û¢Be efficient. Work out smarter not necessarily harder/longer‰Û¢Choosing exercises you enjoy will increase the likelihood of compliance‰Û¢Make exercise as convenient as possible‰Û¢Be flexible with your exercise routine. Instead of skipping a workout because you‰Ûªre pressed for time, do an abbreviated versionI cannot wait to keep an eye on your progress! Log away! If you ever have any questions please reach out.. That's what we are here for!Talk to you soon!"
5018a7dee4b056530e60e04e,8/1/12 3:51,Client,130,,I changed my profile picture to a picture of my bathroom window.  My boyfriend puts notes of encouragement on the mirror each day.
5018a7dee4b056530e60e04e,8/1/12 3:51,Client,12,,I love that!
5018a7dee4b056530e60e04e,8/1/12 3:51,Client,9,,So sweet!
5018a7dee4b056530e60e04e,8/1/12 3:51,Client,15,,That's awesome!
5019f0d5e4b056530e60e4e9,8/2/12 3:15,Client,329,,Tomorrow I'll be driving to San Antonio and back.  I'll take food for breakfast/snacks with me but will probably go out to eat with coworkers.  Since I'm from out of town I'll probably get to choose the place. I'll have to choose someplace where I can get a salad or fish.  Preferably a place that doesn't put bread on the table.
501b46f3e4b056530e60ea30,8/3/12 3:35,Client,113,,Had a long exhausting day to San Antonio and back.  Did good on my food intake but not quite up to 5000 steps :-(
501b46f3e4b056530e60ea30,8/3/12 3:35,Client,76,,Celebrate the fact thst despite the exhausting day you kept to the food plan
501b46f3e4b056530e60ea30,8/3/12 3:35,Client,103,,"..but you were so close! Great job.you can always march in place to get that step count up as well :)"
501c45fee4b056530e60ee83,8/3/12 21:43,Client,176,,Hope you have recovered from your trip to San Antonio.  Keep up the great work with your food choices as well as the food logging.  Looking forward to talking to you next week.
501c49e5e4b056530e60eebd,8/3/12 22:00,Client,832,,"Had another crazy day today.  I spent most of the day in a rural county where I work every other Friday.  Today was my last day to be there since I will retiring soon.  Some of the people wanted to take me out of lunch.  Options were limited.  There are two restaurants in town and one was closed due to a death in the family.  The other restaurant had a buffet and I was told they would have fish since it was Friday.  When we got there, they had run out of fish and only had enchiladas left.  I took two cheese enchiladas, which didn't look too bad because they had a chili sauce on top, not a cheese sauce.  I passed on the beans and rice and had green beans and salad instead,When I got back to my office, the building was surround by police, fire rescue vehicles, etc.  I headed home to find out there had been a bomb threat!"
501c49e5e4b056530e60eebd,8/3/12 22:00,Client,24,,Wow! Talk about eventful
501c49e5e4b056530e60eebd,8/3/12 22:00,Client,127,,Turns out the bomb (or suspected bomb) was in the Driver's License building.  Not a surprise :-) Another dissatisfied customer.
501ffd72e4b056530e5c11be,8/6/12 17:22,ExerciseLog,36,,Fabulous! Way to go! I love the goal
501ffdace4b056530e5c1252,8/6/12 17:23,ExerciseLog,28,,I bet that felt really good.
50212fc4e4b056530e60fce0,8/7/12 15:09,Client,56,,I'm off work today so I've set another 10K walking goal!
50212fc4e4b056530e60fce0,8/7/12 15:09,Client,11,,Great goal!
5022cc77e4b056530e5c160d,8/8/12 20:30,ExerciseLog,19,,Woo Hoo! Great job!
50273d67e4b056530e6113ce,8/11/12 5:21,Client,55,,I got some goodies in the mail from Retofit yesterday!!
50273d67e4b056530e6113ce,8/11/12 5:21,Client,49,,Yaayy!! let me know if you have any questions! :)
50283c7de4b056530e6115de,8/12/12 23:30,Client,536,,"Hey    it was great speaking with you today. As per our conversation I'm posting a summary of the tasks for the upcoming weeks. I look forward to seeing you note your small successes on the timeline.Like we discussed your tasks for the upcoming weeks:1. Take the smaller outfit and hang up in visible place 2.To record and log situations in which negative eating occurs and what the triggers are on the timeline and to continue to log successes3. To continue to be thorough and vigilant in recording meals on the timeline."
50295e85e4b056530e5c1894,8/13/12 20:07,ExerciseLog,376,,"i am so sorry for the late response... I do not know of any specific brands that I prefer. I would suggest that if you want the extra support to be sure that whatever you decide to buy does  not fit too tightly. A lot of times you can cut off circulation to other areas from applying too much compression. Did you find anything? Again, I am so sorry for my delayed response!"
50295e85e4b056530e5c1894,8/13/12 20:07,ExerciseLog,326,,I found one online that is made with small beads of some sort.  I haven't received it yet but it is supposed to conform better.  I had tried one in the past that was made with a silicone bar that went under the knee but I could not wear it for long because I would break out in a rash or abrasion.  Couldn't really tell which.
50295e85e4b056530e5c1894,8/13/12 20:07,ExerciseLog,76,,"Ok , well let me know when you recieve it and we can see if it is a good fit"
50296333e4b056530e5c1a07,8/13/12 20:27,ExerciseLog,20,,That sounds fabulous
5029658ce4b056530e5c1ac8,8/13/12 20:37,ExerciseLog,22,,and... how did it go?!
5029658ce4b056530e5c1ac8,8/13/12 20:37,ExerciseLog,48,,"It was tougher than usual, but I made it through"
502b10fce4b056530e6123ea,8/15/12 3:01,Client,139,,"Hard to believe my weight fluctuated that much compared to yesterday!  A Two pound loss is great, but I'm expecting to go back up tomorrow."
502ba22ee4b056530e5c1e10,8/15/12 13:20,ExerciseLog,37,,Awesome. How did you feel afterwards?
502bdcfee4b056530e6126d3,8/15/12 17:31,Client,93,,"Hey I'm here on Skype for our check in. If you are around can you sign on?Thanks"
502be8cde4b056530e6126f3,8/15/12 18:22,Client,106,,"A coworker just stopped in my office and offered me some of those yummy andes mints.  I said """"no, thanks""""!"
502be8cde4b056530e6126f3,8/15/12 18:22,Client,8,,Success!
502be8cde4b056530e6126f3,8/15/12 18:22,Client,5,,Nice!
502be8cde4b056530e6126f3,8/15/12 18:22,Client,4,,*WIN
502c3eafe4b056530e6128ca,8/16/12 0:28,Client,117,,Great job with your continued logging and fantastic food choices.  Let me know if you have any questions.  Take care.
5030ee55e4b056530e5c228b,8/19/12 13:47,ExerciseLog,122,,Exactly! Something is always better than nothing... if you don't have the time an abbreviated version is ALWAYS an option.
50356ae9e4b056530e614aac,8/21/12 23:27,Client,158,,"Went over my calorie goal today :-(  Had a hard time spacing out my food because I went didn't work today, had errands to do, and went to a lunchtime meeting."
503423c5e4b056530e6144ef,8/22/12 0:11,Client,46,,"Not feeling well, so I didn't go rowing today."
50356a37e4b056530e614aa7,8/22/12 23:24,Client,26,,Still not feeling well :-(
50356a37e4b056530e614aa7,8/22/12 23:24,Client,30,,So sorry to hear! Feel better!
50359e13e4b056530e614bbd,8/23/12 3:05,Client,90,,Sorry you are not feeling well.  Take care of yourself.  Let me know if you need anything.
5037b5cbe4b056530e615529,8/24/12 17:11,Client,87,,"Hey ,How are you feeling today? I hope better...Any plans for the weekend?"
5037b5cbe4b056530e615529,8/24/12 17:11,Client,395,,"I'm feeling a little better.  Whatever I'm doing this weekend, it will be inside :-)  Between the heat, mosquitoes, and spraying they've been doing to eradicate West Nile virus, it's not a good time to be outdoors.  Last weekend, I cleaned out my refrigerator and linen closet.  Not much fun, but I felt good afterwards.  Plus it's good exercise -- all that bending, climbing, carrying, etc....!"
5037b5cbe4b056530e615529,8/24/12 17:11,Client,186,,"Oh wow..it sounds like you got it worse than us in the midwest as far as mosquitoes. Nothing like having a clean house and getting a good workout in... Killing 2 birds with 1 stone. :)"
5038ee7ae4b056530e5c2bbd,8/25/12 15:25,ExerciseLog,20,,I love it! Way to go
503914cce4b056530e61588a,8/25/12 18:09,Client,235,,",  Glad you are feeling better.  As always....love to see your consistent food logging!  How is the....table/chair/plate going?  I know it can be difficult...but useful long-term.  Have a great weekend...even if it is indoors!"
503a979ee4b056530e5c2cd0,8/26/12 21:39,ExerciseLog,85,,That sounds like the perfect post-sick day. Great job jumping back on the band wagon.
503b72d9e4b056530e5c2d84,8/27/12 13:15,ExerciseLog,98,,what were you doing when you felt the pain? The specific movement? Has this been an ongoing issue?
503b72d9e4b056530e5c2d84,8/27/12 13:15,ExerciseLog,127,,Has been a problem for about one month.  I think target practice Saturday night started this episode and Pilates aggravated it.
503b7fa0e4b056530e615d47,8/27/12 14:09,Client,104,,"Hey ,I hope you had a great weekend! Do you have a couple minutes to chat today or tomorrow?"
503b7fa0e4b056530e615d47,8/27/12 14:09,Client,40,,Anytime Tuesday between 1130 am and 2 pm
503b7fa0e4b056530e615d47,8/27/12 14:09,Client,43,,I will call you around 11:30am tomorrow. :)
503b7fa0e4b056530e615d47,8/27/12 14:09,Client,4,,okay
503b7fa0e4b056530e615d47,8/27/12 14:09,Client,15,,phone or skype?
503c0377e4b056530e61620b,8/27/12 23:32,Client,346,,"Hey , it was great to meet again.  As we discussed, remember to continue:1.Keeping motivators handy and looking at them multiple times during the day- especially when entering tempting situation2.Keeping track of both slip-ups and success on the timeline3.  Logging food consistently4.  Trying to record an ABCDE thought situation"
503cf760e4b056530e616667,8/28/12 16:52,Client,319,,"Hey ! First off, I love to see all the greeen at the top of your page :)Secondly, I would love to get a session on the books with you for sometime next week. What do you have available? I have a great, wide open schedule... So, you pick the time and date and I will make it happen.Speak to you soon!"
503cf760e4b056530e616667,8/28/12 16:52,Client,78,,"How about next Tuesday, 9/4, at 11:00 am or in the evening at 5, 530, or 6:00?"
503cf760e4b056530e616667,8/28/12 16:52,Client,66,,9/4 11a is great. I am setting us up now! I will talk to you then!
503e4903e4b056530e5c31d5,8/29/12 16:53,ExerciseLog,10,,Very nice.
503e4903e4b056530e5c31d5,8/29/12 16:53,ExerciseLog,32,,What do you do when you go swim?
503e4903e4b056530e5c31d5,8/29/12 16:53,ExerciseLog,212,,"This time I mostly did a kickboard.  I swam a couple of laps freestyle, but since my elbow has been bothering me I didn't want to overdo it.  I also did some deep water treading, doing figure eights with my arms."
503f8db6e4b056530e6171d7,8/30/12 15:58,Client,27,,Yay!  Broke the 180 mark!!!
503f8db6e4b056530e6171d7,8/30/12 15:58,Client,11,,Yaaayyy!!! 
503f8db6e4b056530e6171d7,8/30/12 15:58,Client,11,,Congrats!!!
503f8db6e4b056530e6171d7,8/30/12 15:58,Client,27,,You are awesome!  Congrats!
503f8db6e4b056530e6171d7,8/30/12 15:58,Client,99,,"Such an awesome WIN!!! A great way to start the holiday weekend! Keep up the great work !"
5042a0d4e4b056530e617d0d,9/1/12 23:57,Client,351,,"Was on a boat in the gulf of Mexico most of the day so I'll have to work to get all my steps in.  Not much opportunity on board.  Did see a family of porpoise though, so it was worth it :-)  Also took my own food so I was able to avoid things like potato salad, potato chips, goldfish crackers (all right, I had three), and homemade choc chip cookies."
5042a0d4e4b056530e617d0d,9/1/12 23:57,Client,39,,That's fantastic! Nice preplanning work
5042a0d4e4b056530e617d0d,9/1/12 23:57,Client,255,,"The hostess was very nice about me bringing my own food.  She made sure I had everything I needed and gave me a """"pat on the back/keep up the good work"""" when we left.  We usually go to her house for Thanksgiving so it is good to know how supportive she is."
5042a0d4e4b056530e617d0d,9/1/12 23:57,Client,20,,That is so wonderful
5049308ee4b056530e619700,9/3/12 23:23,Client,268,,"Had a bad late evening.  Was """"starving"""" around midnight and had about 3 oz of cheese and a couple of crackers.  Brought my calorie total to a little over 2000 for the day.  I think that's the most I've had in one day since I started.  I guess it could have been worse."
5049308ee4b056530e619700,9/3/12 23:23,Client,301,,"That's good control for a craving.  remember that by definition a craving is both transitory and, can be satisfied with a  little of the food that is being craved.  Taking out a small discrete amount and slowly eating it will do wonders to address it. We'll talk more about cravings when we meet next."
5049308ee4b056530e619700,9/3/12 23:23,Client,183,,"Good point.  I felt bad that I """"gave in"""" but at least it was somewhat controlled, rather than a gallon of ice cream.  :-)  I guess 2 crackers and a piece of cheese isn't all that bad."
5049308ee4b056530e619700,9/3/12 23:23,Client,50,,Exactly! Now you're ready to come rip-roarin back!
