ConversationID,occurredDate,conversationType,notesLength,emoticon,notes
50ccc4c8e4b056530e63ccd9,12/14/12 18:43,Client,37,,"Calories expended 2234, consumed 1704"
50cf5931e4b056530e63ccdc,12/15/12 17:41,Client,37,,"Calories expended 2171, consumed 1690"
50cf5b04e4b056530e63ccdf,12/16/12 17:48,Client,37,,"calories expended 2132, consumed 1739"
50cfbf92e4b056530e65432e,12/17/12 0:57,Client,352,,"Hey , it was great to meet again.  As we discussed, remember to:Strategies: 1.	Read the following articles on weight loss plateaus http://www.mayoclinic.com/health/weight-loss-plateau/MY01152/NSECTIONGROUP=2http://exercise.about.com/cs/weightloss/a/weightplateaus.htm2.	Post a small success to timeline at least once every other day"
50d10e90e4b056530e689810,12/19/12 0:48,Client,568,,"We updated the Retrofit site on Sunday and wanted to mention two long-requested enhancements.  First, you can now delete posts and comments you make on your timeline (look for an X in the top-right corner of the post/comment).Second, we update your My Data tab in near-real time anytime your Fitbit or Withings data is updated.  You no longer need to request manual data updates.Finally, you will see a new 'Programs' tab at the top which lists start and end date information about your current Retrofit plan (and, if you are on Retrofit Next, your year 1 plan)."
50d12f0de4b056530e654376,12/19/12 3:05,Client,196,,"Hey, I just wanted to let you know that I will be unavailable to respond on timeline from 12/23/12 to 1/3/13.  If you need anything please reach out to the Program Adviser.  Have a happy holiday!!"
50d4ad3ee4b056530e63cce2,12/20/12 18:41,Client,87,,I stopped taking daily Pepcid about two weeks ago and have not had any reflux problems!
50d4ad3ee4b056530e63cce2,12/20/12 18:41,Client,15,,That's awesome!
50d4ad3ee4b056530e63cce2,12/20/12 18:41,Client,86,,"That is a a huge success, ! Anytime you can stop taking medication is a plus!"
50d4ad3ee4b056530e63cce2,12/20/12 18:41,Client,395,,That is such exciting news !  It is so great to see your continued success week after week!  When this time of year is filled with rich foods and desserts...you're way ahead of the game and only have 10 pounds to go to get to your goal!  Do hesitate to reach out if you need additional support!  Looking forward to our next session!  Wish you the best Christmas with family and friends.
50d4ad3ee4b056530e63cce2,12/20/12 18:41,Client,36,,That is fantatsic!! Merry Christmas!
50d5d35ae4b056530e63cced,12/21/12 15:35,Client,35,,"Calories burned 2185, consumed 1609"
50d5f28ee4b056530e5d186b,12/22/12 17:49,ExerciseLog,41,,How did it feel? And how are YOU feeling?
50d5f28ee4b056530e5d186b,12/22/12 17:49,ExerciseLog,270,,"It turns out I broke a rib in the fall I had on 12/1.  Have not been able to do any swimming, rowing, Pilates.  Just walking.  Thought I'd add the leg exercises back in.  Rib is actually feeling good, but it need to take it easy on the upper body for about 2 more weeks."
50d5f28ee4b056530e5d186b,12/22/12 17:49,ExerciseLog,105,,"I heard about that! No worries, I think adding in lower body is a great way to ease back into everything."
50db7467e4b056530e6ac2d2,12/25/12 22:04,Client,38,,how are you getting all those steps???
50db7467e4b056530e6ac2d2,12/25/12 22:04,Client,183,,I walk at least 3500 steps in the morning when I get up.  Most of the time the rest comes through my normal activities although every once in a while I do another walk in the evening.
50db7467e4b056530e6ac2d2,12/25/12 22:04,Client,25,,I love how aware you are!
50db3b66e4b056530e63ccf0,12/26/12 18:01,Client,25,,Yay!  Broke the 169 mark!
50db3b66e4b056530e63ccf0,12/26/12 18:01,Client,0,Smiley1,
50db3b66e4b056530e63ccf0,12/26/12 18:01,Client,7,,Woohoo!
50db3b66e4b056530e63ccf0,12/26/12 18:01,Client,11,,FABULOUS!!!
50dc7b69e4b056530e63ccf9,12/27/12 16:46,Client,45,,Got into another old pair of jeans yesterday!
50df5286e4b056530e63ccfc,12/28/12 20:28,Client,97,,Put jeans that I was able to get into in October into the Goodwill box.  They are now too big :-)
50df5286e4b056530e63ccfc,12/28/12 20:28,Client,10,,I love it!
50e70144e4b056530e63cd01,1/3/13 16:20,Client,37,,"Calories consumed 1707, expended 2238"
50e87729e4b056530e63cd04,1/4/13 18:55,Client,37,,"Expended 2187 calories, consumed 1685"
50eadcdce4b056530e54d809,1/7/13 14:34,FoodLog,50,Smiley2,Great to see your food choices....they look great!
50eb60c5e4b056530e6b08c4,1/7/13 23:56,Client,774,,"Hi , I thought this would be a great idea for you. You are starting your 27th week in your program (a little over 1/2 way) and are still making amazing progress. You have 25 weeks left and we want to make sure that we capture and recognize all the changes you have made for yourself. One great way to do this is by having you retake the Life Style Patterns Quiz. You took this in the beginning of the program. You can find the link to retake your lifestyle patterns quiz under your quiz results tab on your dashboard. In the upper left hand corner you should have the link that says retake quiz. Once completed you will be able to view and compare your past and present results. We should schedule a checkin call in the near future to go over your results."
50ecc00ce4b056530e65441b,1/9/13 0:55,Client,595,,"Dear , it has been so wonderful working with you. Congratulations on all of the amazing changes you have made and the success you have achieved. Below are the keys to success that we discussed. Even though our sessions have ended I am here to support you so please feel free to reach out via timeline or email.1. Remember in difficult situations the goal is to ‰ÛÏmaintain‰Ûù, not to lose weight- focus on damage control2. Bounce back to routine when the difficult time passes3. Use walking and reading as alternative coping skills4. Celebrate, celebrate, celebrate (buy new clothing!)"
50ecd968e4b056530e5d1874,1/9/13 2:43,ExerciseLog,34,,Great! How did the body handle it?
50ecd968e4b056530e5d1874,1/9/13 2:43,ExerciseLog,105,,"I was SORE today.  Hard to get out of bed but it worked itself out.  Muscle soreness, not joint soreness."
50ecd968e4b056530e5d1874,1/9/13 2:43,ExerciseLog,177,,"perfect! I am so glad you pushed through and got out of bed... The hardest part is always getting moving.. I like to say, """"motion is lotion"""" :) Keep me posted how tomorrow goes."
50f0f1cae4b056530e54d816,1/12/13 5:16,FoodLog,104,,How is the Indian food?  Be careful of the dried fruit...its delicious....but can be high in calories!!!
50f0f1cae4b056530e54d816,1/12/13 5:16,FoodLog,77,,I measure the dried fruit so that I get between and 80 - 100 calorie serving.
50f0f1cae4b056530e54d816,1/12/13 5:16,FoodLog,12,,way to go!!!
50f2e37de4b056530e65449c,1/13/13 16:40,Client,147,,"Hi , I wanted to check in and see if there was anything I could be of help.  How are you doing? Congrats on losing over a pound this week!"
50f2e37de4b056530e65449c,1/13/13 16:40,Client,133,,"Hi  - I've been sick since Friday, maybe the flu.  I think the weight loss may indicate that I need to be drinking more water :-("
50f2e37de4b056530e65449c,1/13/13 16:40,Client,62,,"Got it.  So sorry to hear, drink that water and feel better!!!"
50f4ad06e4b056530e61c9f6,1/15/13 1:12,Client,890,,"It was nuce to chat for a bit tonight, I think you are on the right path to recovery. Your mindset is there and we do not have to play the catch up game! Which is absolutely fantatstic and you should be very proud of yourself. Goals:*Nice and easy: we want to gradually ease into everything- back into rowing next week- start off gradually and test the waters- Pliates- elbow permitting in the next couple of weeks- Back into the pool, weather permitting- continue steps- getting to 10k per day is so easy now! :)We will regroup before I leave for vacation in the next couple of weeks to see how you are feeling and how your body is feeling. We have a grand total 3.5 session left before the end of your program! Lets start thinking about how we want to divvy them up over next 6 months or so! We can always change them but it will be nice to get a game plan in place. Feel better!"
50f880b9e4b056530e63cd07,1/17/13 22:52,Client,70,,Feeling a little better today.  May start doing some walking tomorrow.
50f880b9e4b056530e63cd07,1/17/13 22:52,Client,51,,I am so glad you are feeling somewhat normal again!
50f880b9e4b056530e63cd07,1/17/13 22:52,Client,13,,Glad to hear!
50fc5bbee4b056530e6ac2dc,1/20/13 21:03,Client,63,,Glad you are feeling better!  Let me know if you need anything.
50fc5bbee4b056530e6ac2dc,1/20/13 21:03,Client,74,,"So far, so good!  Kind of bummed out about gaining two pounds overnight!!!"
50fc5bbee4b056530e6ac2dc,1/20/13 21:03,Client,404,,"Remember there is 3500 calories in 1 pound....so for it to be a true 2 lb weight gain you would have had to take in an additional 7000 calories above and beyond what it takes to maintain your current weight!  So....I bet it is due to being sick, medications you might have taken etc,  I bet once you get back on your normal routine....the number will come right back down...and then some!  Hang in there."
5101ec63e4b056530e5d187d,1/25/13 2:22,ExerciseLog,39,,Wow! Fabulous- everything ok after it!?
5101ec63e4b056530e5d187d,1/25/13 2:22,ExerciseLog,50,,So far so good.  We'll see how I feel Saturday :-)
5101ec63e4b056530e5d187d,1/25/13 2:22,ExerciseLog,15,,Keep me posted!
5103da49e4b056530e61ca4a,1/26/13 13:29,Client,281,,"Good morning !I just wanted to lremind you know that I will be on vacation from Sunday, January 27th until Sunday, February 8th. Please reach out to your team if you have any questions! I will check in when I return and we can get our 15 min on the calendar!Best,"
5109ba53e4b056530e54d824,1/31/13 0:26,FoodLog,62,,Looks like you are trying some new things...how is that going?
5109ba53e4b056530e54d824,1/31/13 0:26,FoodLog,393,,"I found a turkey meatloaf w/veggies dinner at our local health food store that you take home and heat up.  It's really good and there's enough for two meals.  The minestrone with meatballs was something my boyfriend made last night.  He made the turkey meatballs from scratch and then put them in Progresso soup.  It was great!  He's a good cook when I can get him to cook something healthy."
5111e1a2e4b056530e5d1889,2/6/13 4:52,ExerciseLog,0,Smiley2,
5111e261e4b056530e6ac2f9,2/6/13 4:56,Client,267,,"Hi , glad to see your food logs and that you are able to get back into the rowing.  Wanted to check and see how you were doing and make sure you are drinking enough fluid!  Will you be trying any new foods anytime soon!  Love to see that variety!  Take care."
5111e261e4b056530e6ac2f9,2/6/13 4:56,Client,307,,Getting kind of discouraged because I seem to have reached a plateau.  My weight is swinging up and down pretty regularly sometimes over a pound at a time.  Could it be that I'm not getting enough fluids?  I'm working back more vigorous exercise slowly so as not to reinjure my rib.  So far it's doing okay.
5111e261e4b056530e6ac2f9,2/6/13 4:56,Client,876,,"I noticed your weight fluctuating too!  Definitely if you are not drinking enough...it can effect your weight/loss.  In addition if you have been taking any type of anti-inflammatories for your injuries...that can make you retain water.  I am glad that you are slowly building that activity back in.  Are you still tracking your calories on the Fitbit site?  I have seen you post your calories consumed...calories expended....if you are eating at the calories for your goal (160#)...looking back at my notes...we estimated that you should be around 1461 calories a day...365 calories for breakfast, lunch and dinner at 183 calories each... for 2 snacks.  I hope as you increase your activity and your fluid...your weight loss will increase, however it may be worth seeing if you can decrease your calories in....closer to the 1461 calories.  Let me know what I can do to help."
5111e261e4b056530e6ac2f9,2/6/13 4:56,Client,249,,"No NSAIDs except for the occasional headache.  Yes, I'm still using Fitbit and have been using their calculations based on the goal of losing 1/2 pound a week -- eating 500 fewer calories than I am expending.  That's what I have been doing all along"
5111e261e4b056530e6ac2f9,2/6/13 4:56,Client,470,,"Unfortunately as you get closer to that goal....the weight loss will slow down.  Would you be willing to go back and try eating like you were when you started?  If you need help with that, I can go back on the timeline and look up what you were eating.  I am wondering about the dried fruit that you have been eating....even though you are tracking the calories of them...it may be worth changing them out for some fresh fruit...less calories and more water content too!"
5111e261e4b056530e6ac2f9,2/6/13 4:56,Client,425,,"I can go back on the timeline and look, no need for you to do it.  I'll switch out the dried fruit, that's not a problem.  It was convenient because I could take it with me in a ziplock and not have to worry about purchasing a snack in a convenience store, but I'll find something else that's portable.  I stopped buying bananas a couple of weeks ago because they are higher in calories and went back to more berries instead."
51156803e4b056530e5d1884,2/8/13 21:02,ExerciseLog,10,,Awesome!!!
51198fd9e4b056530e54d839,2/12/13 0:42,FoodLog,34,,"Whoops, myfitfoods.com, not meals."
51198fd9e4b056530e54d839,2/12/13 0:42,FoodLog,622,,"Wow....how great that they are actually in the HEB!  The guy who started this company acutally lives in Austin and here MyFitFoods are free standing buildings and you have to make a separate trip!  I know their philsophy is using fresh, healthy foods...which is probably why it is so expensive.  But you are right...when you are traveling or too busy to cook....they would be a better choice than a frozen meal with a lot of sodium, preservatives etc.  Heck, you may even get some ideas for some quick, healthy meals you can prepare yourself.  Great tool to use, I think.  Let me know what meals/snacks are your favorites!"
511ac49be4b056530e63cd0e,2/12/13 22:39,Client,233,,"Yay!  I get a new outfit.  I set a goal of seven consecutive days of under 169 pounds and met that today.  Seems like the last few weeks my weight was seesawing so much that I would get five or six days in a row, then go up over 169."
511ac49be4b056530e63cd0e,2/12/13 22:39,Client,62,,Woohoo... What a great treat for yourself! Congrats !
511ac49be4b056530e63cd0e,2/12/13 22:39,Client,22,Smiley2,Way to go !!!
511ac49be4b056530e63cd0e,2/12/13 22:39,Client,26,,Way to celebrate! Love it!
511ac49be4b056530e63cd0e,2/12/13 22:39,Client,0,Smiley1,
511b088de4b056530e5d1894,2/13/13 3:29,ExerciseLog,78,,Sure! What time were you thinking? We can use up that extra 15 we had leftover
511b088de4b056530e5d1894,2/13/13 3:29,ExerciseLog,245,,"Actually, I hadn't thought this through much.  I'm available Wed and Thur night (any time is ok), but then my best friend is visiting from out of town until the 25th.  If you can't do it in the next couple of days we can do it the 25th or after."
511b088de4b056530e5d1894,2/13/13 3:29,ExerciseLog,99,,"Yikes! I am sorry I am just now seeing this! Yes, lets do after the 25th... How about that evening?"
511b088de4b056530e5d1894,2/13/13 3:29,ExerciseLog,75,,The 25th is okay.  Whatever time is good for you.  I'm in the Central zone.
511b088de4b056530e5d1894,2/13/13 3:29,ExerciseLog,23,,7p eastern.. 6 central?
511b1499e4b056530e6ac314,2/13/13 4:20,Client,368,,"You are doing fabulous !  Have you had a chance to look back at your food logs?  If so, what did you learn/what changes or adjustments did you make?  Sometimes just when we think the scale will not ever budge...all of a sudden we have a great loss...crazy!!!  I know we don't have a session booked...but let me know if you have any questions or need anything."
511b1499e4b056530e6ac314,2/13/13 4:20,Client,306,,"You were right, I was eating much more fresh fruit and veggies, yogurt, so I've been working those back in.  I also was cooking more, which is something I've never liked to do and to be honest, still don't.  So I've been looking at other ways to get healthier meals (see post below about HEB My Fit Foods)."
5123dce1e4b056530e6b1502,2/19/13 20:13,Client,187,,"Hi ,With being 33 weeks in and only 4.5% to go to your goal... I think this would be a great time to get a checkin call scheduled. Do you have any time this Friday or next week?"
51282b9de4b056530e54d843,2/23/13 2:38,FoodLog,115,Smiley2,Finding any entrees that you enjoy?  What veggies are you adding?  Only 5-6 lbs till your goal!  How are you doing?
51284429e4b056530e63cd19,2/23/13 4:23,Client,161,,"Hi!  Just wanted to let everyone know that I haven't been logging lately because my mother-in-law died Tuesday night.  Hopefully, I'll be back in sync next week."
51284429e4b056530e63cd19,2/23/13 4:23,Client,94,,Sorry to hear about your mother in law...my thoughts are with you and your family.  Take care.
51284429e4b056530e63cd19,2/23/13 4:23,Client,41,,"I am so sorry , thinking of you!"
51284429e4b056530e63cd19,2/23/13 4:23,Client,71,,Oh my...So sorry to hear that. Keep you and your family in my thoughts.
51284429e4b056530e63cd19,2/23/13 4:23,Client,78,,I am so sorry to hear . We are here to support you in any way we can.
512a515ce4b056530e6b163d,2/24/13 17:43,Client,144,,"Happy Birthday !Even during this sad time...We hope you have a wonderful, healthy day! We are thinking of you!--Your Retrofit Team!"
512c1d5be4b056530e6ac32a,2/26/13 2:26,Client,276,,I hope you were able to do something to celebrate your Birthday...I know this is a difficult time and probably your eating and exercise routine is off.  Hang in there...do what you can do!  Do not hesitate to reach out to myself or the other wellness team members for support!
51314a4de4b056530e5d18a6,3/2/13 0:39,ExerciseLog,28,,great job!! How did it feel?
51314a4de4b056530e5d18a6,3/2/13 0:39,ExerciseLog,28,,It was hard getting started!
51314a4de4b056530e5d18a6,3/2/13 0:39,ExerciseLog,36,,I'll start swimming on Monday night.
51314a4de4b056530e5d18a6,3/2/13 0:39,ExerciseLog,175,,"Fantastic! Would you like to meet later next week? Once you go to a night of swimming? We can do a 45 min session, 15 min or just 30min since we have that extra 15 in the bank"
51314a4de4b056530e5d18a6,3/2/13 0:39,ExerciseLog,82,,How about Thursday night?  Any time is fine with me.  I'm in the Central Time Zone
51314a4de4b056530e5d18a6,3/2/13 0:39,ExerciseLog,46,,How about we plan on 8p eastern so 7p central?
51314a4de4b056530e5d18a6,3/2/13 0:39,ExerciseLog,18,,That works for me.
51314a4de4b056530e5d18a6,3/2/13 0:39,ExerciseLog,27,,"great, I will see you then!"
513510fee4b056530e63cd24,3/4/13 21:24,Client,96,,Went to dentist today.  Said he didn't recognize me when I first walked in due to weight loss!!!
513510fee4b056530e63cd24,3/4/13 21:24,Client,26,,NO!!!! Thats is Awesome!!!
513510fee4b056530e63cd24,3/4/13 21:24,Client,53,,Even more proof that you're getting results! Amazing!
513510fee4b056530e63cd24,3/4/13 21:24,Client,12,,Congrats!!!!
513510fee4b056530e63cd24,3/4/13 21:24,Client,0,Smiley2,
5137f19fe4b056530e5d18b4,3/7/13 1:47,ExerciseLog,0,ThumbsUp,
513a9c0de4b056530e6ac342,3/9/13 2:18,Client,347,,"5 lbs to your goal!!!!  Are you still using some of the My Fit Foods?  Seems like you are adding some new and different foods in.  We have 2 sessions left, why don't we schedule one soon and then the last one for either before or after you get back from Cuba!  Let me know what will work best for you in the next week or so!  Have a great weekend."
513a9c0de4b056530e6ac342,3/9/13 2:18,Client,311,,"Yes, I'm still using the My Fit Foods.  I've been getting the large meals and splitting them in thirds then adding veggies.  It helps to keep the cost down that way because they are pretty expensive.  If you want to meet next week, Tuesday or Thursday evening would work for me.  Any time that's good for you."
513a9c0de4b056530e6ac342,3/9/13 2:18,Client,51,,"How does Thursday, March 14th at 7 pm work for you?"
513a9c0de4b056530e6ac342,3/9/13 2:18,Client,18,,That works for me.
513a9c0de4b056530e6ac342,3/9/13 2:18,Client,34,,"Awesome...I will """"Skype"""" you then!"
513feb41e4b056530e6b1a5a,3/13/13 2:58,Client,115,,"Hi Any chance we can schedule a call for this week or next? I know you are meeting with Tarie this week."
513feb41e4b056530e6b1a5a,3/13/13 2:58,Client,103,,We're going out of town Friday so how about next week?  Do you want to do it during the day or evening?
513feb41e4b056530e6b1a5a,3/13/13 2:58,Client,18,,Day would be best.
513feb41e4b056530e6b1a5a,3/13/13 2:58,Client,47,,How about Monday?  Anytime between 11am - 1 pm.
513feb41e4b056530e6b1a5a,3/13/13 2:58,Client,39,,How about 11:30am or 11:45am on Monday?
513feb41e4b056530e6b1a5a,3/13/13 2:58,Client,19,,11:45 works for me!
513feb41e4b056530e6b1a5a,3/13/13 2:58,Client,0,ThumbsUp,
5141102be4b056530e5d18bc,3/13/13 23:47,ExerciseLog,22,,How did it feel? Good?
5141102be4b056530e5d18bc,3/13/13 23:47,ExerciseLog,17,Smiley2,"Yep, no problems."
514260f5e4b056530e5d18c2,3/14/13 23:44,ExerciseLog,14,,whew is right!
51428698e4b056530e6ac350,3/15/13 2:25,Client,608,,"It was great catching up with you this evening.  I am glad that your retirement has been keeping you busy...I hope you are enjoying your time.  I wanted to encourage you to keep progressing with the exercise (swimming, rowing and soon Pilates) and to work on increasing your fluid intake.  These 2 behaviors alone will have a big impact on your weight/weight loss.  We would also love to see your food logs etc on the Dashboard....this will help to see the relationship between your weight and your exercise and food intake.  Enjoy your trip to Dallas and do not hesitate to let me know if you need anything."
51434ae3e4b056530e63cd2f,3/15/13 16:22,Client,116,,Leaving for San Antonio this afternoon and Dallas tomorrow.  Will be back Sunday night.  Am taking scale and Fitbit!
51434ae3e4b056530e63cd2f,3/15/13 16:22,Client,0,Smiley1,
51472d6fe4b056530e63cd34,3/18/13 15:06,Client,92,,:  Call me on my home phone.  I have misplaced my webcam and haven't found it yet :-(
51472d6fe4b056530e63cd34,3/18/13 15:06,Client,30,,Will do. Talk to you in a bit.
5147c4c7e4b056530e68a2b1,3/19/13 1:53,Client,942,,"You may have noticed your Fitbit steps are not syncing to Retrofit in a timely manner. Fitbit has has been experiencing a server overload due to a high volume. They have since expanded their server capacity, however are continuing to have issues sending step data to Retrofit. We are working with Fitbit to resolve the issue as soon as possible.Please note that your step data is still syncing from your Fitbit Tracker to the Fitbit site.  We just aren't getting those updates in real time.  Your step data is still automatically downloaded to Retrofit every morning at 4AM CST. If you wish to manually update your Fitbit data to Retrofit you may do so by following these instructions:1. Go to your settings page https://www.retrofitme.com/app/settings2. Scroll to the bottom to Devices, then click the blue Update Data button for Fitbit.We will let you know when this issue is resolved.  Thanks, (your Retrofit Tech Guru)"
5147e95be4b056530e63cd39,3/19/13 4:28,Client,169,,"Got my Fitbit wet very briefly, but it stopped working nonetheless.  Have it in a bag of rice, per instructions on their website.  Hope I can get it to work tomorrow :-("
5147e95be4b056530e63cd39,3/19/13 4:28,Client,107,ThumbsDown,"Oh no! Let me know. If needed you can order one through us at a 40% discount. ($64.00 instead of $104.00)"
5147e95be4b056530e63cd39,3/19/13 4:28,Client,9,Smiley1,It works!
5147e95be4b056530e63cd39,3/19/13 4:28,Client,0,ThumbsUp,
5147e95be4b056530e63cd39,3/19/13 4:28,Client,160,,My fitbit came back to life too.. Mine went through the wash and revived itself after sitting in rice.. resilient little suckers! Glad to hear it is working!!!!
51488427e4b056530e68ad1b,3/19/13 15:29,Client,223,,"Fitbit syncing update: We worked with Fitbit to resolve the sync issue.‰Ûâ Everything is back to normal.‰Ûâ Thanks for your patience while we figured this out. Sorry for any inconvenience. (your Retrofit Tech Guru)"
514a5630e4b056530e5d18c7,3/21/13 0:37,ExerciseLog,0,Smiley1,
514cb4bee4b056530e63cd44,3/22/13 19:45,Client,38,,Am starting PT for my elbow next week.
514cb4bee4b056530e63cd44,3/22/13 19:45,Client,10,,Very good!
514f417ae4b056530e5d18ce,3/24/13 18:10,ExerciseLog,67,,hahaha I hope so too! That is definitely a workout.. On all fronts.
514facd7e4b056530e63cd49,3/25/13 1:48,Client,161,,Bummed out about weight gain past three days in spite of lots of exercise and eating well.  I took lots of Benadryl Fri and Sat so I'm hoping that's the culprit.
514facd7e4b056530e63cd49,3/25/13 1:48,Client,77,,"Well, I started my period.  That may explain it.  First one in six months :-("
514facd7e4b056530e63cd49,3/25/13 1:48,Client,194,Smiley4,"Well that certainly explains a lot doesn't it?!!!!  Crazy hormones!!!  Can certainly effect your weight....water retention etc, as well as possible cravings for salt etc.  Hope you are doing OK!"
514facd7e4b056530e63cd49,3/25/13 1:48,Client,57,,Silly hormones. I am sure that is what has been going on.
51538cc6e4b056530e5d18d3,3/28/13 0:20,ExerciseLog,30,,hahahha good job!!!! Its tough
5154ed9be4b056530e63cd52,3/29/13 1:25,Client,115,,Was a guest lecturer at class at our local university tonight.  Had difficulty finding a skirt that wasn't too big!
5154ed9be4b056530e63cd52,3/29/13 1:25,Client,39,Smiley2,Time to go shopping again!!! Way to go!
